{
  "schema_version": "1.0",
  "artifact_type": "story_bible",
  "project": {
    "id": "fallen-minister-territory",
    "title": "망국의 재상은 일곱 살 차남으로 환생했다 — 형님이 검을 들면, 저는 영지를 살립니다",
    "language": "ko-KR",
    "genre": ["중세 판타지", "영지 경영", "코미디", "성장"],
    "audience": "성장형 판타지와 영지 경영의 누적 성과를 좋아하는 웹툰 독자"
  },
  "premise": {
    "logline": "매년 다른 재앙과 제국 전쟁 사이에서 나라를 잃은 재상이, 일곱 살 남작가의 차남으로 환생해 기사 지망생 형과 작은 변방 영지를 살려 낸다.",
    "series_question": "한 번 경제 기반을 만들지 못해 왕국을 잃은 재상은, 이번에는 사람과 시간을 믿으며 재앙과 전쟁이 만나는 순간을 바꿀 수 있는가?",
    "promise": "한 아이의 기발한 고집으로 시작한 창고·도로·시장·보급선이, 형의 용맹과 주민들의 삶을 바꾸고 결국 망국의 진짜 원인까지 드러내는 유쾌한 성장 영지물."
  },
  "themes": ["망국의 죄책감과 두 번째 기회", "성장은 혼자 완성할 수 없는 시스템", "전쟁을 이기는 일과 사람을 살리는 일", "가족이 되는 과정"],
  "world": {
    "era": "세 제국이 완충 왕국과 교역로를 두고 국지전을 반복하는 후기 봉건 판타지 시대",
    "locations": [
      {"id": "rowend-march", "name": "로웬드 변경백령의 발트하르트 남작령", "function": "숲·습지·오래된 강 나루를 품은 작은 변방 영지이자 두 형제의 개발 실험장"},
      {"id": "grayford", "name": "그레이포드 나루", "function": "곡물과 목재가 드나들 수 있지만 홍수와 통행세 분쟁에 취약한 유일한 교역 관문"},
      {"id": "three-empire-border", "name": "삼제국 접경로", "function": "전쟁, 난민, 밀수, 군수 수요가 로웬드에 밀려드는 외부 압력의 통로"}
    ],
    "rules": [
      "대륙은 해마다 가뭄·홍수·병충해·혹한·전염병·마력폭풍처럼 성격이 다른 재앙을 겪으며, 어느 재앙이 올지는 정확히 예측할 수 없다.",
      "재앙은 곡물·노동력·세수·병력 중 하나 이상을 무너뜨리고, 회복 전에 다음 전쟁의 징발과 통행세가 찾아온다.",
      "마법은 존재하지만 식량, 운송, 인력, 신뢰를 대체하지 못한다. 군대와 주민은 여전히 먹고 쉬고 길을 건너야 한다.",
      "전생의 재상은 같은 대륙에서 환생했으나 미래를 아는 예언자는 아니다. 그는 재정·보급·협상에서 실패한 경험만 기억한다.",
      "발트하르트 남작령은 왕국 귀족 체계 안에 있으나 실질적으로는 제국 국경과 더 가까워, 작은 성공도 빠르게 외부의 주목을 받는다."
    ]
  },
  "characters": [
    {
      "id": "theo-waldhart",
      "name": "테오 발트하르트",
      "role": "일곱 살 남작가 차남이자 망국의 재상이 환생한 주인공",
      "age_at_start": 7,
      "want": "이번 생에서는 가족과 주민이 굶주리거나 버려지지 않는 작은 영지를 만들고 싶다.",
      "need": "모든 재난을 혼자 계산해 통제하려는 습관을 버리고, 사람에게 역할과 실패할 여지를 맡겨야 한다.",
      "conflict": "늙은 재상의 판단력은 있으나 일곱 살 아이에게는 법적 권한·체력·신뢰가 없고, 그의 과도한 대비는 가족을 불안하게 만든다.",
      "voice": ["겉으로는 또래답게 짧고 솔직하게 말하려 애쓴다", "당황하면 장부·배급·동선 같은 숫자 비유가 튀어나온다", "형에게는 투덜대지만 가장 먼저 형의 귀환을 계산한다"],
      "growth_arc": {
        "physical_and_social": "일곱 살의 작은 차남에서 열세 살의 견습 영주로 자라며, 옷·자세·말투와 가신들 앞에서의 책임이 함께 변한다.",
        "role_progression": "비상식량을 숨기는 아이에서 세금·시장·도로·군수와 외교의 연결을 설계하는 영지 운영자로 성장한다.",
        "emotional": "망국의 모든 책임을 자기 몫으로 여기던 사람에서, 형·가신·주민과 성과와 실패를 나누는 가족의 일원이 된다."
      },
      "past_life": {
        "name": "에드릭 아르켄",
        "role": "멸망한 아르켄 왕국의 재상",
        "age_at_death": 46,
        "failure": "해마다 다른 재앙이 생산과 세수를 무너뜨리는 동안 지속 가능한 경제 기반을 만들지 못했고, 회복할 틈 없이 제국들 사이 전쟁의 군수·외교 압력에 왕국을 잃었다.",
        "core_wound": "마지막까지 정확한 장부를 만들었지만, 장부 밖에서 굶고 떠난 사람들을 지키지 못했다는 죄책감"
      },
      "identity_lock": {
        "silhouette": "형의 망토 자락을 붙잡고 다니는 작고 단정한 차남, 시간이 갈수록 장부 가방과 짧은 견습 망토가 자란다",
        "face": "둥근 어린 얼굴과 유난히 진지한 회색 눈, 생각에 잠기면 미간을 찌푸리는 버릇",
        "hair": "부드럽게 흩어지는 짙은 밤색 단발머리, 자라면서 목덜미와 앞머리 길이가 자연스럽게 변한다",
        "body": "시작은 또래보다 약간 작은 일곱 살 체형이며, 연도 이정표에 따라 팔다리 길이와 어깨선이 성장한다",
        "palette": ["#28384a", "#d9c59a", "#8e5f3d", "#b9c7c9"],
        "signature_items": ["가죽끈으로 묶은 작은 장부", "형에게서 빌린 너무 큰 파란 망토", "곡물 알갱이를 넣어 둔 주머니"]
      }
    },
    {
      "id": "kyle-waldhart",
      "name": "카일 발트하르트",
      "role": "열네 살 장남이자 장차 전장을 이끄는 기사, 주인공의 형",
      "age_at_start": 14,
      "want": "가문과 영지를 지킬 강한 기사가 되어 아버지와 동생이 두려워하지 않게 하고 싶다.",
      "need": "눈앞의 결투와 승리만큼 병사·말·주민이 돌아올 길을 소중히 여겨야 한다.",
      "conflict": "전장에서 빠른 결단이 필요한 그는 동생의 끝없는 대비와 계산을 답답해하지만, 그 계산이 자신과 병사들을 살린다는 사실을 배운다.",
      "voice": ["행동부터 하고 나중에 설명한다", "동생을 놀리지만 남이 무시하면 즉시 편든다", "어려운 장부는 싫어하지만 사람 이름은 잘 기억한다"],
      "growth_arc": {
        "physical_and_social": "열네 살 견습 기사에서 스무 살의 젊은 기사 지휘관으로 성장하며, 소년의 체형과 훈련복이 전투 장비와 책임의 무게로 바뀐다.",
        "role_progression": "가문의 검에서 소규모 순찰대장, 국경 방위 지휘관으로 올라가며 동생의 보급·전략을 현실의 전술로 완성한다.",
        "emotional": "동생을 보호해야 할 어린애로 보던 형에서, 서로가 없으면 영지를 지킬 수 없다는 동료로 받아들인다."
      },
      "past_life": null,
      "identity_lock": {
        "silhouette": "긴 팔다리와 넓은 어깨가 먼저 자라는 견습 기사, 성장할수록 푸른 망토와 장검의 비율이 안정된다",
        "face": "햇볕에 그을린 밝은 갈색 피부, 크게 웃는 입, 동생과 닮은 회색 눈",
        "hair": "짧게 자른 적갈색 머리, 훈련 뒤에는 앞머리가 흐트러진다",
        "body": "열네 살의 빠르게 자라는 탄탄한 체형에서 성인 기사 체형으로 자연스럽게 성장한다",
        "palette": ["#295a84", "#a54f36", "#d7d1bd", "#4a4139"],
        "signature_items": ["파란 발트하르트 가문 망토", "연습용 목검에서 시작해 성장 후 받는 장검", "동생의 장부를 넣어 다니는 안장 주머니"]
      }
    },
    {
      "id": "bram-waldhart",
      "name": "브람 발트하르트",
      "role": "로웬드의 소영주이자 두 형제의 아버지",
      "age_at_start": 39,
      "want": "빚과 국경 분쟁 속에서도 영지를 지키고 두 아들이 서로를 해치지 않게 하고 싶다.",
      "need": "오늘을 버티는 보수적 판단만으로는 아이들이 살아갈 내일을 지킬 수 없음을 인정해야 한다.",
      "conflict": "일곱 살 차남의 기묘하게 현실적인 요구를 들어주면 가문의 질서가 흔들리고, 무시하면 영지가 놓칠 기회를 직감한다.",
      "voice": ["짧고 투박하게 말한다", "웃음으로 불안을 감춘다", "결정 순간에는 누구보다 빠르게 책임을 진다"],
      "growth_arc": {
        "physical_and_social": "가문을 홀로 떠받치는 지친 소영주에서, 다음 세대에게 권한을 나눌 줄 아는 영지의 후견인으로 변한다.",
        "role_progression": "빚을 막는 영주에서 영지 연합과 왕국 정치 사이를 중재하는 지역 지도자로 성장한다.",
        "emotional": "아들들을 자신의 실패를 메울 도구로 보지 않고, 각자의 방식으로 살아갈 사람으로 존중한다."
      },
      "past_life": null,
      "identity_lock": {
        "silhouette": "낡은 사냥 망토와 실용적인 검을 든 넓은 어깨의 변방 영주",
        "face": "짙은 수염과 눈가의 깊은 주름, 아들들과 닮은 회색 눈",
        "hair": "관자놀이부터 희끗해지는 짧은 밤색 머리",
        "body": "오랜 순찰과 행정 피로가 남은 강건한 중년 체형",
        "palette": ["#384237", "#6e5039", "#c3b28c", "#2f343d"],
        "signature_items": ["군데군데 기운 가족 인장 반지", "수선한 사냥 망토", "빚 문서가 든 철제 상자 열쇠"]
      }
    }
  ],
  "timeline": {
    "calendar": "대륙력",
    "start": {"year": 673, "season": "초봄"},
    "aging_policy": "calendar_continuous",
    "milestones": [
      {"id": "season-001", "year": 673, "label": "일곱 살 차남의 첫 창고와 봄 홍수", "age_by_character": {"theo-waldhart": 7, "kyle-waldhart": 14, "bram-waldhart": 39}},
      {"id": "arc-001", "year": 674, "label": "첫 수확, 난민 정착, 형의 견습 기사 서약", "age_by_character": {"theo-waldhart": 8, "kyle-waldhart": 15, "bram-waldhart": 40}},
      {"id": "arc-002", "year": 676, "label": "나루 시장과 보급로를 둘러싼 귀족 분쟁", "age_by_character": {"theo-waldhart": 10, "kyle-waldhart": 17, "bram-waldhart": 42}},
      {"id": "arc-003", "year": 679, "label": "국경 전쟁과 망국 장부의 재등장", "age_by_character": {"theo-waldhart": 13, "kyle-waldhart": 20, "bram-waldhart": 45}}
    ]
  },
  "story_engine": {
    "episode_pattern": "계절 재앙이나 전쟁 압력이 영지의 한 부족함을 드러낸다. 테오는 제한된 자원으로 개발·교섭·배급 계획을 내고, 카일과 주민들이 그 계획의 빈틈을 몸으로 메운다. 작은 성공은 새 인력·시장·방어력을 남기지만 동시에 더 큰 귀족이나 제국의 관심을 부른다.",
    "escalation": "비상식량과 배수로에서 시작해 난민 정착, 나루 시장, 도로·창고·군수 체계, 국경 연합과 제국 외교로 문제의 질을 바꾼다. 영지가 커질수록 재난은 경제 문제가 아니라 정통성·정보·전쟁의 문제가 된다.",
    "season_arc": "첫 시즌은 봄 홍수 뒤의 식량 위기와 빚으로 무너질 뻔한 발트하르트 남작령을 지키는 이야기다. 테오는 전생처럼 혼자 장부를 붙들려 하고, 카일은 동생의 기묘한 계획을 믿고 주민을 움직인다. 마지막에는 재난 피해를 의도적으로 키운 누군가의 흔적과 아르켄 왕국의 군수 장부가 발견된다.",
    "territory_state_model": {
      "tracked_metrics": ["식량 잔여일", "인구", "은화", "치안", "민심", "병력", "보급량"],
      "sibling_roles": {"theo-waldhart": "경제·보급·장기 전략·협상", "kyle-waldhart": "현장 지휘·전술·훈련·구조"},
      "comedy_rule": "테오의 합리적인 계획은 종종 일곱 살 아이의 놀이·투정·엉뚱한 수집으로 오해받고, 그 오해가 예상 밖의 동맹과 문제를 만든다."
    }
  },
  "continuity_rules": [
    "테오와 카일의 나이는 대륙력과 함께 계속 증가한다. 시간 경과가 있는 회차는 두 사람의 나이·체형·옷의 맞음새·사회적 권한을 함께 갱신한다.",
    "테오는 전생의 행정과 실패를 기억하지만 현대 지식, 미래 예지, 만능 발명 능력을 갖지 않는다.",
    "카일은 전장의 결정과 전술적 위험을 담당하며, 테오는 보급·경제·전략을 담당한다. 어느 한쪽이 상대의 전문성을 반복적으로 대체하지 않는다.",
    "영지의 시설·인구·빚·관계는 재난과 전쟁 이후 되돌아가지 않는다. 성공에는 유지비와 정치적 대가가, 실패에는 회복 시간과 감정적 흔적이 남는다.",
    "코미디는 어린 몸과 전생 기억의 낙차에서 나오되, 재난·전쟁·주민의 피해를 가볍게 소비하지 않는다."
  ]
}
