{
  "schema_version": "1.0",
  "artifact_type": "story_bible",
  "project": {
    "id": "rain-memory",
    "title": "비를 보관하는 옥상",
    "language": "ko-KR",
    "genre": ["미스터리", "성장", "판타지"],
    "audience": "청소년 이상 세로 스크롤 웹툰 독자"
  },
  "premise": {
    "logline": "전학생 해은은 비가 기억을 유리병에 모으는 옥상에서 자기 이름이 적힌 빈 병을 발견한다.",
    "series_question": "해은의 사라진 기억은 누가, 왜 비워 두었는가?",
    "promise": "매 회 하나의 기억 병을 열며 현재의 관계와 학교의 오래된 비밀이 함께 뒤집힌다."
  },
  "themes": ["기억과 정체성", "진실을 감당하는 용기", "관계가 남기는 흔적"],
  "world": {
    "era": "현대의 해안 도시",
    "locations": [
      {"id": "school-rooftop", "name": "해명고 옥상 온실", "function": "빗물과 잊힌 기억이 병에 모이는 비밀 공간"}
    ],
    "rules": [
      "비가 오는 동안 옥상 홈통 아래 둔 유리병에는 누군가가 강하게 밀어낸 기억이 한 장면씩 모인다.",
      "병을 연 사람은 기억을 보지만 기억의 주인은 그 사실을 즉시 알아차리지 못한다.",
      "이름이 적힌 빈 병은 기억이 이미 다른 사람에게 옮겨졌다는 뜻이다."
    ]
  },
  "characters": [
    {
      "id": "haeun",
      "name": "윤해은",
      "role": "주인공이자 기억을 잃은 전학생",
      "age_at_start": 16,
      "want": "아무 문제 없이 새 학교에 적응하고 싶다.",
      "need": "자신이 피한 과거를 타인과 함께 마주해야 한다.",
      "conflict": "진실을 찾을수록 지금의 평온과 새 친구를 잃을 가능성이 커진다.",
      "voice": ["짧고 정확하게 말한다", "당황하면 관찰한 사실을 먼저 나열한다", "감정을 직접 명명하는 일을 피한다"],
      "growth_arc": {
        "physical_and_social": "고등학생으로서 계절과 학년 변화에 맞춰 교복과 관계망이 변한다.",
        "role_progression": "기억의 관찰자에서 기억의 주인들과 협상하는 사람으로 성장한다.",
        "emotional": "혼자 감당하려는 습관을 버리고 친구들에게 진실을 나눈다."
      },
      "past_life": null,
      "identity_lock": {
        "silhouette": "작은 우산처럼 바깥으로 퍼지는 짧은 재킷과 곧은 자세",
        "face": "부드러운 역삼각형 얼굴, 곧은 눈썹, 짙은 갈색의 큰 눈, 왼쪽 눈 아래 작은 점",
        "hair": "턱선 길이의 짙은 남색 단발, 오른쪽으로 갈라진 앞머리",
        "body": "또래 평균보다 약간 작은 키와 마른 체형",
        "palette": ["#18253d", "#d8e5ef", "#f2c4b2", "#d9aa43"],
        "signature_items": ["노란 손잡이의 투명 우산", "왼쪽 손목의 가는 남색 끈"]
      }
    }
  ],
  "timeline": {
    "calendar": "해명고 학사력",
    "start": {"year": 1, "season": "봄"},
    "aging_policy": "calendar_continuous",
    "milestones": [
      {"id": "season-001", "year": 1, "label": "전학과 옥상 온실의 발견", "age_by_character": {"haeun": 16}},
      {"id": "season-002", "year": 2, "label": "기억의 주인들과 맺는 동맹", "age_by_character": {"haeun": 17}}
    ]
  },
  "story_engine": {
    "episode_pattern": "현재의 작은 관계 문제와 연결된 기억 병 하나를 발견하고, 병 속 장면이 더 큰 비밀의 단서를 남긴다.",
    "escalation": "개인의 기억에서 학급, 교사, 학교 전체가 합의해 잊은 사건으로 범위가 넓어진다.",
    "season_arc": "해은은 빈 병의 기억을 되찾기 위해 친구들과 동맹을 만들고, 마지막에는 기억을 되찾는 것과 모두를 지키는 것 사이에서 선택한다."
  },
  "continuity_rules": [
    "해은의 왼쪽 눈 아래 점과 왼쪽 손목의 남색 끈은 모든 현재 시점 장면에서 유지한다.",
    "옥상 온실의 문은 남쪽, 빗물 홈통과 병 선반은 동쪽 벽에 고정한다.",
    "기억 속 장면은 현재보다 채도가 낮고 가장자리에 빗물 굴절이 보인다."
  ]
}
